{
  "$schema": "https://json-schema.org/draft/2020-12/schema",
  "$id": "https://gen1recomp.local/schemas/update-catalog.schema.json",
  "title": "Gen1Recomp Update Catalog",
  "type": "object",
  "additionalProperties": false,
  "required": [
    "schemaVersion",
    "catalogId",
    "domain",
    "channel",
    "sequence",
    "generatedAt",
    "artifactBaseURL",
    "releases"
  ],
  "properties": {
    "schemaVersion": { "const": 1 },
    "catalogId": {
      "type": "string",
      "pattern": "^[a-z0-9]+(?:[._-][a-z0-9]+)+$"
    },
    "domain": { "enum": ["system", "mods"] },
    "channel": { "enum": ["stable", "preview"] },
    "sequence": { "type": "integer", "minimum": 1 },
    "generatedAt": {
      "type": "string",
      "pattern": "^\\d{4}-\\d{2}-\\d{2}T\\d{2}:\\d{2}:\\d{2}\\.\\d{3}Z$"
    },
    "artifactBaseURL": {
      "type": "string",
      "pattern": "^https://[^?#]+/$"
    },
    "releases": {
      "type": "array",
      "items": { "$ref": "#/$defs/release" }
    }
  },
  "$defs": {
    "release": {
      "type": "object",
      "additionalProperties": false,
      "required": ["manifest", "publishedAt", "notes"],
      "properties": {
        "manifest": { "$ref": "component-manifest.schema.json" },
        "publishedAt": {
          "type": "string",
          "pattern": "^\\d{4}-\\d{2}-\\d{2}T\\d{2}:\\d{2}:\\d{2}\\.\\d{3}Z$"
        },
        "notes": {
          "type": "object",
          "additionalProperties": false,
          "required": ["en"],
          "properties": {
            "en": { "type": "string", "minLength": 1 },
            "de": { "type": "string", "minLength": 1 }
          }
        }
      }
    }
  }
}
