{
  "artifactBaseURL": "https://raw.githubusercontent.com/workspacedive/gen1recomp/main/updates/artifacts/",
  "catalogId": "org.gen1recomp.system",
  "channel": "stable",
  "domain": "system",
  "generatedAt": "2026-08-16T20:00:00.000Z",
  "releases": [
    {
      "manifest": {
        "apiVersion": "1.0.0",
        "artifact": {
          "integrity": {
            "algorithm": "sha256",
            "digest": "0f3645d57748652457b541f82dd0548e99758ccaa9fdf3c4f545d95434ace265"
          },
          "path": "org.gen1recomp.core-0.1.96.zip",
          "size": 5873738
        },
        "capabilities": [],
        "compatibility": {
          "hostProtocol": "^1.0.0",
          "kernelApi": "^1.0.0",
          "loveApi": "11.5.x",
          "modApi": "^2.0.0"
        },
        "dependencies": [
          {
            "id": "org.gen1recomp.runtime.lovejs",
            "range": "^0.1.0"
          }
        ],
        "id": "org.gen1recomp.core",
        "kind": "core",
        "migrations": [],
        "schemaVersion": 1,
        "selfTests": [],
        "version": "0.1.96"
      },
      "notes": {
        "de": "Gepinnter ROM-freier Gen1Recomp-0.1.96-Core-Payload.",
        "en": "Pinned ROM-free Gen1Recomp 0.1.96 core payload."
      },
      "publishedAt": "2026-08-16T18:00:00.000Z"
    },
    {
      "manifest": {
        "apiVersion": "11.5.0",
        "artifact": {
          "integrity": {
            "algorithm": "sha256",
            "digest": "612ae7fe1415210ed58d678322b083db6720418d62faae90ba593074049e6313"
          },
          "path": "org.gen1recomp.runtime.lovejs-0.1.0.zip",
          "size": 1713624
        },
        "capabilities": [],
        "compatibility": {
          "hostProtocol": "^1.0.0",
          "platformApi": "^1.0.0"
        },
        "dependencies": [],
        "id": "org.gen1recomp.runtime.lovejs",
        "kind": "runtime",
        "migrations": [],
        "schemaVersion": 1,
        "selfTests": [],
        "version": "0.1.0"
      },
      "notes": {
        "de": "Gepinnte love.js-L\u00d6VE-11.5-/Lua-Laufzeit f\u00fcr den iOS-Pfad ohne Worker.",
        "en": "Pinned love.js L\u00d6VE 11.5 and Lua runtime for the no-worker iOS path."
      },
      "publishedAt": "2026-08-11T19:51:49.000Z"
    }
  ],
  "schemaVersion": 1,
  "sequence": 1
}
